id,question
116,Can you name the primary libraries used for implementing machine learning algorithms and deep learning models?
117,What is a statistical model used for?
117,How are models constructed in data analysis?
117,What role do models play in decision-making?
118,How is K-fold cross-validation typically implemented?
118,What is the primary goal when using K-fold cross-validation in machine learning?
118,Describe a scenario where K-fold cross-validation would be particularly useful.
119,What strategies can be employed to address the cold start problem?
119,How do recommendation systems provide personalized recommendations for new users or items with sparse data?
119,What methods enable recommendation systems to recommend items based on user attributes and similarities?
120,What is the purpose of classification in machine learning?
120,How does a model determine the category of a new observation?
120,What type of prediction does a classifier make based on training data?
121,What strategies can be employed to address binary classification imbalance?
121,How can we improve classifier performance in minority class identification?
121,What techniques are used to rebalance class distribution and ensure reliable predictions?
122,What is a chatbot's primary function?
122,How does a chatbot interact with human users?
122,What are the main purposes of using a chatbot?
123,What terms are used interchangeably to describe factors that may affect an outcome?
123,List variables that can influence outcomes in statistical analysis.
123,What factors are essential for understanding relationships and making predictions?
124,What planning technique in AI allows for flexible order of operations?
124,How does partial order planning enable more complex planning scenarios?
124,In what context is the exact sequence of actions not predetermined?
125,What algorithms are used for hyperparameter optimization in machine learning?
125,List different methods to find optimal hyperparameters for a model.
125,Which search strategies can be employed to optimize hyperparameters?
126,What tools are used for enterprise data integration in ETL processes?
126,Which software is utilized for data management and integration during the ETL process?
126,How do you handle large volumes of data using an ETL tool?
127,What are the two main approaches to combining models?
127,How do parallel methods like Bagging improve predictions?
127,What is the key difference between sequential and parallel ensemble methods?
128,What is a simple machine learning algorithm used for classification and regression tasks?
128,How does KNN classify query points based on their neighbors?
128,What assumption does KNN rely on to make predictions?
129,What geometric concept is used in SVM to find the optimal hyperplane?
129,How does the convex hull relate to data separation in machine learning?
129,In what context is the maximum margin of a hyperplane maximized?
130,"What type of model is logistic regression, despite its name?"
130,How does logistic regression handle classification tasks?
130,Is the decision boundary in logistic regression linear or non-linear?
131,What types of RNNs address vanishing gradient problem?
131,List architectures enhancing RNN capabilities for sequential data processing.
131,Which variants cater to different requirements in NLP and sequential modeling?
132,What is the primary characteristic of weak AI?
132,How does weak AI differ from AGI in terms of cognitive abilities?
132,List three examples of applications where weak AI can be effectively used.
133,What is TF/IDF vectorization used for?
133,How does TF/IDF convert text into numerical vectors?
133,What tasks can benefit from TF/IDF analysis?
134,What parameters are set before model training?
134,How do these parameters influence model performance and behavior?
134,Why is careful selection and tuning of these parameters necessary?
135,What are the three main loop control statements in programming?
135,How do you skip to the next iteration in a loop?
135,What happens when you use the break statement in a loop?
136,What happens to CNN predictions if an image is rotated?
136,How do rotations affect a CNN's performance on images?
136,Can CNNs handle rotated input images without affecting their predictions?
137,What statistical method is used to estimate English language complexity?
137,How can letter sequences in English be analyzed for probabilistic insights?
137,What technique evaluates the information content of the English language?
138,What is the process of breaking down sentences to understand their grammatical structure?
138,How are sentences analyzed to identify relationships between words in NLP tasks?
138,What is crucial for understanding natural language and other related NLP activities?
139,What statistical techniques are used in econometrics?
139,How does econometrics help understand economic relationships?
139,What is the purpose of using historical data in econometrics?
140,What are the distinct purposes of % and / operators in Python?
140,"How does floor division, represented by // operator, differ from regular division in Python?"
140,In what scenarios would you use the % operator to compute remainders in Python?
141,What is Jupyter Notebook?
141,Describe an interactive computing environment.
141,List programming languages supported by Jupyter.
142,What is the Bag of Words model used for?
142,How does the Bag of Words model simplify text?
142,What are the benefits of using the Bag of Words model in text classification?
143,What technique in computer vision allows a model to leverage knowledge from one task on another related task?
143,"How is a pre-trained model adapted for use in a new, but related, computer vision task?"
143,"In the context of computer vision, what does it mean to 'repurpose' a trained model?"
144,What is PCA used for in data analysis?
144,How does PCA simplify complex datasets?
144,What are the benefits of using PCA in various fields?
145,What algorithm does Facebook use for face verification?
145,How does DeepFace classify faces accurately?
145,What is the primary method used by Facebook to detect and align faces?
146,What are the main purposes of OLAP and OLTP systems?
146,How do OLTP and OLAP databases differ in terms of structure?
146,What type of data is typically handled by OLTP versus OLAP systems?
147,What type of models extend traditional linear regression to accommodate non-normal distributions?
147,How do generalized linear models differ from traditional linear regression?
147,Which types of data can be analyzed using generalized linear models?
148,What insights does data profiling provide about individual data attributes?
148,How does data mining differ from data profiling in terms of analysis goals?
148,What types of patterns and relations can be uncovered through data mining?
149,What is Apache OpenNLP?
149,Describe a machine learning-based toolkit for processing natural language text.
149,List common NLP tasks supported by Apache OpenNLP.
150,What is the minimum effect size a statistical test can identify?
150,What is the smallest difference a statistical test can reliably detect?
150,What is the threshold for an effect to be considered statistically significant?
151,What methods can help prevent overfitting and underfitting?
151,How can you ensure a model's performance is not overly dependent on the training data?
151,What techniques can be applied to prevent a model from becoming too complex?
152,What does an S curve represent graphically?
152,Describe the phases of growth in an S-curve.
152,How is an S-curve used for trend analysis and forecasting?
153,What are some popular machine learning libraries?
153,Which frameworks support deep learning models?
153,What environments enable AI model development?
154,What systems assist radiologists in differentiating between benign and malignant findings?
154,How do computer-aided diagnosis (CADx) systems aid medical image interpretation?
154,In what way do CADx systems support the work of radiologists?
155,"What is TensorFlow, a machine learning framework?"
155,Describe the features of TensorFlow for building AI models.
155,What capabilities does TensorFlow offer for deep learning and distributed computing?
156,What does the survival function represent?
156,What is another name for the survival curve?
156,What does the survival function estimate at each time point?
157,How does one efficiently compute inner products between data pairs in a higher-dimensional space?
157,What enables algorithms to operate effectively with lower-dimensional data?
157,In what way can high-dimensional calculations be made feasible with lower-dimensional data?
158,What is ETL process in data integration?
158,"Describe the steps involved in Extract, Transform, Load process."
158,How does ETL help in preparing data for analysis?
159,What statistical technique is used to evaluate model generalization?
159,How does cross-validation partition data for evaluation?
159,What is the purpose of using a test set in cross-validation?
160,What is the purpose of a classification threshold in logistic regression?
160,How does the classification threshold affect class label assignment in probabilistic classifiers?
160,What is the significance of setting a specific cutoff point for predicted probabilities?
161,What is cross-validation used for in machine learning?
161,How does cross-validation evaluate a statistical model's generalizability?
161,Can you describe how cross-validation partitions data to test a model's predictive ability?
162,What types of statistical biases can lead to incorrect conclusions?
162,Can you give an example of a situation where sampling bias occurs?
162,How does confirmation bias affect the accuracy of data analysis?
163,What is COSHH in Hadoop?
163,How does COSHH scheduling work?
163,What are the resource characteristics considered by COSHH?
164,What are data points that deviate significantly from a dataset's general trend?
164,How can outliers indicate measurement errors or rare events in data?
164,Why is it essential to identify and handle outliers in data analysis?
165,What steps are taken to ensure data accuracy?
165,How can data inconsistencies be identified?
165,What validation checks help prevent errors in analysis?
166,What algorithm adjusts learning rates for each parameter individually?
166,How does AdaGrad scale parameters according to past gradients?
166,What is the purpose of using different learning rates in Adagrad?
167,What type of algorithm generates Amazon's 'Customers who purchased this item also bought...' suggestions?
167,How do Amazon's product recommendations work without needing to know the features of items themselves?
167,What technique does Amazon use to suggest products based on user behavior and transaction history?
168,What parameter is used to determine the number of trees in a random forest?
168,How can you initially select a reasonable number of trees for a random forest model?
168,At what point should you stop adding trees to a random forest model?
169,What does Q-Learning entail in reinforcement learning?
169,How does an agent learn optimal actions using Q-Learning?
169,In what way does Q-Learning enable an agent to discover the best course of action?
170,What are the primary differences between supervised and unsupervised learning in data science?
170,How does labeled data contribute to prediction and classification in machine learning?
170,Can you describe a scenario where patterns and relationships are discovered without prior knowledge of the outcome?
171,What is the primary goal of recommendation algorithms?
171,How do recommendation algorithms use historical data to make predictions?
171,In what types of platforms are recommendation algorithms commonly used?
172,What are the benefits of creating detailed flowcharts for business processes?
172,How can mapping out business steps improve efficiency?
172,What is the purpose of identifying and streamlining workflow in a business process?
173,What binary format transformation is used for categorical variables?
173,How are categories represented in one-hot encoding?
173,What ensures interpretability of machine learning models when dealing with categorical data?
174,What statistical concept assesses alignment between observed data and expected patterns?
174,How does one validate the accuracy of a statistical model in relation to real-world data?
174,What is the purpose of goodness of fit in evaluating the effectiveness of statistical models?
175,What mathematical formula or algorithm is used to process sample data?
175,How does an estimator produce a value from sample data?
175,What is the purpose of using an estimator in statistical analysis?
176,What is the purpose of comparing probabilities between two groups?
176,How does relative risk differ from odds ratios and hazard ratios?
176,Why is understanding relative risk crucial in epidemiology and clinical research?
177,What is a fundamental unit used in neural networks for binary classification?
177,Describe an algorithm that makes predictions using a linear function and weights.
177,What are the inputs weighed with to make predictions in a perceptron?
178,What is the purpose of Information Retrieval?
178,How does Information Extraction differ from database searches?
178,What are the primary functions of Information Extraction in text analysis?
179,What is the primary framework for text engineering?
179,Describe the modular design of a comprehensive NLP toolset.
179,What features allow for the integration of additional processing resources in text analysis?
180,What are some practical uses of natural language processing?
180,How does NLP contribute to speech recognition technology?
180,In what ways can virtual assistants benefit from NLP capabilities?
181,What types of data modification occur in a Type 1 SCD?
181,How does a Type 2 SCD preserve historical information?
181,In what way do Type 3 SCDS track changes to the original data?
182,What strategy optimizes network traffic in distributed systems like Hadoop?
182,How does data storage across multiple racks improve reliability in distributed systems?
182,In what way do distributed systems like Hadoop benefit from organizing data storage efficiently?
183,What tools are used for training NLP models?
183,Which libraries are commonly used in NLP model development?
183,List the primary tools utilized in deep learning for natural language processing.
184,What is the initial step in setting the learning rate for machine learning algorithms?
184,How does the learning rate impact model convergence and stability?
184,What is the key factor to consider when adjusting the learning rate during training?
185,What is knowledge engineering in AI?
185,How do knowledge engineers capture human expertise?
185,What techniques are used to encode domain-specific knowledge?
186,What techniques does XGBoost use to balance bias and variance?
186,How does XGBoost combine weak models to improve predictions?
186,What methods does XGBoost employ to reduce overfitting and increase model diversity?
187,What statistical properties must variables have for linear regression to hold?
187,Under what conditions does linear regression assume errors are distributed?
187,Which type of correlation between predictors would invalidate linear regression?
188,How can you transform a pandas DataFrame's structure?
188,What techniques are used to change the shape of a pandas DataFrame?
188,In what ways can you pivot or tidy up a pandas DataFrame?
189,What techniques prevent overfitting in neural networks?
189,How do regularizers like dropout contribute to model simplicity?
189,What is the purpose of disabling neurons randomly during training?
190,What statistical technique is used to analyze the relationship between a continuous dependent variable and a categorical independent variable?
190,How does ANCOVA extend the traditional ANOVA method in analyzing relationships between variables?
190,What is the primary purpose of incorporating covariates into an analysis using ANCOVA?
191,What does true positive mean in terms of diagnostic accuracy?
191,How do true positives relate to a test's ability to detect a condition?
191,What is the significance of true positives in evaluating a medical test?
192,What is the primary goal of managing model complexity in machine learning?
192,How can a balanced model be achieved to prevent underfitting and overfitting?
192,What are the consequences of having high bias or high variance models on predictive performance?
193,What is meant by marginal quantities in data analysis?
193,How does marginalization help in understanding relationships between variables?
193,What is an example of how marginal estimates are used to obtain overall probabilities?
194,What is the role of a library's index in HDFS?
194,"In HDFS, what component keeps track of file locations?"
194,How does the NameNode function in terms of file storage?
195,What is a reference point for comparing model performance?
195,"In machine learning, what serves as a simple starting model?"
195,What establishes a standard against which more complex models are compared?
196,What enables neural networks to learn complex relationships between inputs and outputs?
196,How do activation functions enhance model capacity and expressiveness in neural networks?
196,Why is nonlinearity necessary for neural networks to capture intricate patterns?
197,What search strategy involves running two simultaneous searches?
197,How can we potentially find a solution faster than a unidirectional search?
197,What is the main goal of a bidirectional search algorithm?
198,What happens when gradient descent methods are applied with different initial conditions?
198,Can gradient descent methods converge to the same point under varying cost functions?
198,How do starting conditions affect the convergence of gradient descent methods?
199,What is word2vec used for?
199,How does word2vec predict surrounding words?
199,What type of embeddings does word2vec produce?
200,What type of models learn data categories?
200,How do discriminative models compare to generative models in classification tasks?
200,What is the primary distinction between generative and discriminative models?
