id,question
1,What happens when a machine learning model is too simple?
1,How does overfitting affect a model's performance on new data?
1,"Can a model be too complex, and if so, what are the consequences?"
2,What are the implications of a test result that incorrectly suggests a condition's presence?
2,How does a false indication of a condition's absence impact diagnosis and treatment?
2,Can you describe a situation where a medical test fails to detect an actual condition?
3,What type of studies are conducted after a drug or medical product is made available to the general public?
3,What is the primary goal of Phase IV studies in terms of monitoring a product's safety and efficacy?
3,How do Phase IV studies contribute to informed decision-making about a product's continued use?
4,What is semi-supervised learning?
4,How does semi-supervised learning improve model performance?
4,What are the benefits of using unlabeled data in machine learning?
5,How can gradient boosting models take advantage of modern hardware?
5,What options are available in XGBoost to utilize GPUs for faster training?
5,In what scenarios is parallelizing the training process particularly beneficial?
6,What is a single file that encapsulates specific functionalities in Python?
6,How does a collection of related modules differ from a single file in Python?
6,What can be reused in different programs when using a Python module?
7,What does power in frequentist statistics refer to?
7,How does sample size affect a test's ability to detect an effect?
7,What happens when a study has low power?
8,How does Python handle function arguments?
8,What is the nature of variable passing in Python functions?
8,Can you explain how mutable and immutable data affect argument passing in Python?
9,What type of error occurs due to chance or variability in sampling?
9,How do unpredictable factors affect measurements or observations?
9,What is the primary goal when trying to minimize random errors?
10,What type of graphical representation shows data distribution?
10,How is numerical data typically depicted in a histogram?
10,What visual tool provides insights into data concentration and frequency?
11,What algorithm predicts text tags based on probabilities?
11,How is Naive Bayes used in Natural Language Processing tasks?
11,"In NLP, what does the Naive Bayes algorithm classify?"
12,What is the purpose of random initialization in neural networks?
12,How does symmetry affect feature representation in a neural network?
12,What role do unique signals play in effective learning and model convergence?
13,What statistical methods can prove males are taller on average?
13,How to statistically show that males have a greater average height than females?
13,Can a t-test be used to demonstrate the difference in average heights between males and females?
14,What techniques can reduce noise in a time series dataset?
14,How can data normalization help manage outliers in time series analysis?
14,Which statistical models are robust against anomalies in time series data?
15,What type of plot displays two quantitative variables?
15,How can you visualize patterns in data using two numerical values?
15,What graph allows you to see correlations between two continuous variables?
16,What is the purpose of using groupby in data analysis?
16,How does groupby facilitate summarizing data based on categories?
16,What aggregate functions can be applied to each group using groupby?
17,Which statistical tests are used to identify relevant features in feature selection?
17,How do wrapper methods iteratively add or remove features based on model performance?
17,What is the process of selecting variables that involves filter and wrapper methods?
18,What technique in machine learning maps categorical data into a lower-dimensional space?
18,How do embeddings facilitate models to process and learn from high-dimensional categorical data?
18,In what way can embeddings improve the performance of machine learning models?
19,What models can generate samples from a learned joint probability distribution?
19,"Which type of model is primarily used for classification tasks, focusing on decision boundaries between classes?"
19,What is the primary difference in how generative and discriminative models capture data generation processes?
20,Describe a basic neural network's operation.
20,What is the process by which a basic neural network generates an output?
20,How does a basic neural network learn patterns from data?
21,What is the role of softmax in neural network output?
21,How does softmax function affect neural network predictions?
21,What transformation does softmax apply to neural network outputs?
22,What is the IQR used to measure?
22,How is the interquartile range calculated?
22,Why is the IQR useful in statistical analysis?
23,What is the average difference between predicted and actual values in a dataset?
23,How does Mean Absolute Error (MAE) measure prediction accuracy in regression tasks?
23,"What is the typical magnitude of errors in a model's predictions, as quantified by MAE?"
24,What type of algorithms are modeled loosely after the human brain?
24,How do computers recognize patterns using a specific set of algorithms?
24,What is the primary function of neural networks in problem-solving?
25,What data points are used together in one machine learning model training iteration?
25,How many data points make up a batch for machine learning model training?
25,"In machine learning, what is the term for the number of data points used in each model training iteration?"
26,What techniques are used to artificially expand a training dataset?
26,How does data augmentation improve model robustness?
26,What is the primary goal of image augmentation in machine learning?
27,What is NLTK used for in NLP?
27,NLTK stands for what in Python?
27,What programming language does NLTK use?
28,What technique reduces text data dimensions to capture underlying meaning?
28,How does LSI improve search accuracy in text data?
28,What is the primary goal of applying Latent Semantic Indexing?
29,What enables computers to understand human language?
29,How do NLP systems process text and speech data?
29,"What tasks does NLP encompass, including language translation and sentiment analysis?"
30,What is a structured set of data used for machine learning?
30,Describe the format in which datasets are typically stored.
30,What is inputted into machine learning models?
31,What patterns can models identify in data?
31,How do unsupervised learning algorithms reveal hidden insights?
31,What tasks are facilitated by exploring data's inherent structure?
32,What is requirement prioritization in business and software development?
32,List techniques used for deciding importance of requirements based on impact and urgency.
32,How do stakeholders determine the order of fulfilling business or software development requirements?
33,What techniques can reduce overfitting in SVM models?
33,How does dimensionality reduction impact computational efficiency in SVM?
33,Can high-dimensional datasets benefit from preprocessing before applying an SVM?
34,What makes Apache Spark faster than MapReduce?
34,How does in-memory processing improve data analysis with Spark?
34,What type of algorithms benefit from Spark's iterative capabilities?
35,What is the purpose of rates in various fields?
35,How do rates differ from probabilities?
35,What kind of insights do rates provide about events?
36,What characteristic makes a model prone to overfitting?
36,How do higher capacity models differ from lower ones in terms of data learning?
36,What happens when a high-capacity model is not properly regularized?
37,What is the core concept behind transformer models?
37,How do transformer models improve NLP tasks?
37,What is the key innovation in transformer models that leads to state-of-the-art performance?
38,What are the primary differences between collaborative filtering and content-based filtering?
38,How do collaborative filtering and content-based filtering approach personalized recommendations?
38,In what ways do collaborative filtering and content-based filtering diverge in their recommendation strategies?
39,What ensemble strategy reduces variance by averaging predictions from various models trained on different subsets of data?
39,How do bagging algorithms handle examples that previous models got wrong?
39,Can you describe an approach to sequentially train models with a focus on examples the previous models got wrong?
40,What is the purpose of FSCK?
40,Describe the function of a File System Consistency Check.
40,What does the system utility FSCK do?
41,What statistical methods are used in linear regression?
41,How does OLS minimize distance between actual and predicted values?
41,What is the primary goal of maximum likelihood estimation in logistic regression?
42,What is the primary characteristic of a star schema?
42,How does the snowflake schema differ from the star schema in terms of data redundancy?
42,Which database design approach typically results in faster query speeds but may lead to data redundancy?
43,What mathematical model makes specific assumptions about data distribution?
43,How many parameters does a parametric model have?
43,What is the relationship between input and output variables in a parametric model?
44,What role does game theory play in developing strategies for autonomous agents?
44,How is game theory applied to analyze decision-making processes among multiple decision-makers?
44,In what ways can game theory influence AI applications like negotiation algorithms?
45,What is an autonomous entity in AI that perceives surroundings through sensors?
45,How do agents in AI achieve predefined goals?
45,What type of learning improves agent actions based on feedback?
46,What statistical methods are used to determine if a sample's characteristics can be generalized to the entire population?
46,"Which tests are employed to assess assumptions related to means, variances, and distributions in data analysis?"
46,Can you describe the process of evaluating evidence from a sample to make conclusions about the population?
47,What strategies can be employed to handle missing values in a dataset?
47,How do you replace missing numerical data without disrupting the data distribution?
47,When is it appropriate to exclude a variable from analysis due to excessive missing data?
48,What is a fundamental concept in TensorFlow that represents computational operations?
48,"In the context of TensorFlow, what does a graph define?"
48,How are nodes and edges related in a TensorFlow graph?
49,What method compares two webpage versions to determine which one performs better?
49,How do you decide which product feature is more effective in terms of conversion rates?
49,What statistical technique helps choose between two different versions of a product or service?
50,What does statistical power measure in hypothesis testing?
50,Why is it crucial to consider statistical power in experimental design?
50,How does statistical power relate to rejecting a null hypothesis when an alternative holds?
51,What underlying constructs influence observed data?
51,How do latent variables explain patterns in statistical models?
51,What statistical techniques can be used to infer the values of unobservable variables?
52,What is the purpose of dependency parsing in natural language processing?
52,How do words relate to each other in a sentence according to dependency parsing?
52,"In NLP, what technique maps out the grammatical structure of sentences?"
53,What types of transformations can SVM perform on data?
53,How do kernels enable complex classification in SVM?
53,Which kernel is similar to a neural network?
54,What happens when a subset of data is chosen for analysis without considering the entire population?
54,How can selecting non-representative participants affect the validity of study conclusions?
54,What type of bias occurs when the selected data does not accurately reflect the overall population?
55,What method is used during model training to selectively calculate probabilities for all positive class instances and a random subset of negative ones?
55,How does candidate sampling effectively manage class imbalance during model training?
55,What is the purpose of using candidate sampling in machine learning when dealing with imbalanced datasets?
56,What is a concise way to create lists in Python?
56,How can you efficiently construct dictionaries in Python?
56,What are the benefits of using comprehensions instead of loops and functions?
57,What machine learning algorithms are used for regression tasks?
57,Which classification algorithms are commonly used in machine learning?
57,How do clustering and dimensionality reduction work in unsupervised learning?
58,What does variance measure in a dataset?
58,How is variance related to data points around the mean?
58,What impact does variance have on statistical analyses and decision-making?
59,What is the difference between a single element addition and an iterable addition to a list?
59,How does append() differ from extend() in terms of data integration?
59,"In Python, what method is used for adding multiple elements at once to a list?"
60,What type of reasoning does Statistical AI use?
60,How does Classical AI approach problem-solving?
60,Can you describe the key difference between Statistical and Classical AI?
61,What prevents overfitting in Random Forests?
61,How does randomization contribute to model generalization?
61,What is the effect of introducing diversity in an ensemble?
62,What is a step-by-step procedure for any algorithm?
62,How do you implement a Decision Tree in pseudocode?
62,Can you describe the process of building a tree-based model?
63,What are the benefits of applying dimensionality reduction to an SVM?
63,How does PCA/SVD improve SVM's performance in high-dimensional datasets?
63,Can you explain how reducing features affects SVM's generalization and scalability?
64,What factors influence chart creation?
64,How do relationships between variables impact dashboard design?
64,What features should a chart or dashboard include for user interactivity?
65,What type of data is collected when researchers manipulate variables directly?
65,How do experimental studies differ from observational studies in terms of establishing causality?
65,Why is it essential to understand the distinction between experimental and observational data?
66,What data visualization technique is used to highlight trends?
66,How can conditional formatting aid in anomaly detection?
66,What is the purpose of using conditional formatting in a dataset?
67,What is a regression method used for survival analysis?
67,Which statistical model relates various factors to the time until an event occurs?
67,How does the Cox model handle censored data?
68,What is a range of values that likely contains the population parameter?
68,How does sample variability affect the population parameter?
68,What statistical concept accounts for uncertainty in sample data?
69,What are the primary differences between machine learning and deep learning?
69,How do machine learning and deep learning models approach feature extraction?
69,In what scenarios is deep learning more suitable than traditional machine learning?
70,"What tools enable data engineers to process, analyze, and prepare data efficiently?"
70,"How do libraries like NumPy, pandas, and scipy support data engineering tasks?"
70,What benefits can data engineers gain from leveraging these scientific computing libraries?
71,What is the main goal of combining multiple machine learning models?
71,How do ensemble methods improve model performance compared to a single model?
71,What benefits can be achieved by using ensemble methods in machine learning?
72,What is a basic neural network architecture consisting of a single neuron?
72,How does a perceptron approximate binary inputs?
72,What are the key components involved in a perceptron's output calculation?
73,What is meant by augmented intelligence?
73,How does technology assist humans in decision-making through IA?
73,Can you describe a scenario where human intelligence is enhanced by technology?
74,What are GANs composed of?
74,How do Generative Adversarial Networks generate new data?
74,Can synthetic instances generated by GANs be distinguished from real data?
75,What is the programming language used for NLTK?
75,Which natural language processing library is written in Java?
75,How do the programming languages of NLTK and OpenNLP differ?
76,What algorithm is used to optimize decision-making for game players?
76,Explain how a game player can ensure an optimal strategy against an opponent.
76,What is the key concept behind a minimax algorithm in game theory?
77,What type of study examines historical data to investigate relationships?
77,How do researchers typically collect data for retrospective studies?
77,What are some potential limitations of retrospective studies?
78,What are the primary purposes of data mining and data warehousing?
78,How do data mining and data warehousing differ in their approaches to data analysis?
78,What role do data mining and data warehousing play in enabling informed decision-making?
79,What is the primary difference between processing one observation at a time versus using the entire dataset simultaneously?
79,How do online and batch learning approaches differ in terms of data utilization?
79,Can you describe the key distinction between handling individual observations versus the entire dataset as a whole?
80,What Python libraries are commonly used for data manipulation?
80,Which libraries are typically employed in machine learning tasks?
80,What frameworks are popularly utilized in deep learning applications?
81,What is the purpose of residuals in a statistical model?
81,How do residuals relate to the goodness-of-fit and assumptions of regression models?
81,What should be the ideal distribution of residuals around zero?
82,What measures consistency among human coders?
82,How is reliability in human judgments quantified?
82,What indicates greater accuracy in assessments?
83,What is the primary function of the input layer in neural networks?
83,How does the input layer process raw data in a neural network?
83,What features are represented by nodes in the input layer?
84,What is meant by partitioning a population into distinct subgroups?
84,How does stratified sampling ensure proportional representation of various subgroups?
84,What are the benefits of using stratified sampling in study results?
85,What are the limitations of using mean imputation for missing data?
85,How does mean imputation affect the representation of data and its underlying patterns or distributions?
85,Why is it generally discouraged to use mean imputation in handling missing data?
86,What techniques are used to forecast time series data in machine learning?
86,How do autoregressive models contribute to time series forecasting?
86,What advanced methods can be employed for complex pattern recognition in sequential data?
87,What is the primary purpose of Root Mean Squared Error (RMSE) in regression analysis?
87,How does RMSE measure the dispersion or variability of data points around a regression line?
87,What does taking the square root of the mean squared error achieve in terms of model performance comparison?
88,What does OLAP stand for in data warehousing?
88,How do OLAP systems support business intelligence applications?
88,What type of analysis is facilitated by OLAP systems?
89,What methods can help prevent a model from overfitting?
89,How can you ensure a model's performance is not limited to training data?
89,What techniques reduce the risk of building overly complex models?
90,What type of learning uses labeled data for training?
90,How does unsupervised learning handle unlabeled data?
90,What are some common tasks that unsupervised learning is useful for?
91,What operation allows you to access a single element in a sequence?
91,How do you retrieve multiple elements from a sequence at once?
91,What is the purpose of using indexing versus slicing in data manipulation?
92,What is machine learning and its primary objectives?
92,Describe the approach used in machine learning to perform tasks.
92,"List the techniques and algorithms used for pattern recognition, prediction, and decision-making."
93,What direction does the gradient point in for a function?
93,How is the gradient used to optimize functions?
93,What is the primary purpose of calculating the gradient?
94,What is the purpose of retaining information within a defined timeframe?
94,How does limited memory impact tasks requiring temporal context or real-time processing?
94,What are the key characteristics of systems that can retain information for only a short period?
95,What would be the implications of surpassing human cognitive abilities?
95,How might artificial intelligence fundamentally alter societal structures?
95,What are some potential benefits and risks associated with significantly exceeding human intelligence?
96,What tangible outcomes are expected from a project?
96,What is handed over to clients or stakeholders upon project completion?
96,What objectives must be fulfilled by the end of a project?
97,What type of string matching allows for similar but not identical patterns?
97,"In search functions, what technique is used to identify non-identical strings?"
97,What data cleaning method uses fuzzy string matching?
98,What iterative process updates model parameters to minimize loss?
98,How do gradients influence adjustments to weights and biases in a model?
98,What is the primary goal of adjusting weights and biases based on computed gradients?
99,What happens when a statistical test incorrectly concludes there's an effect?
99,How does a Type I error affect our understanding of data?
99,What is the probability of mistakenly rejecting the null hypothesis?
100,What is a network that makes decisions by considering how changing one piece can affect the whole?
100,How does an RBM simplify the decision-making process of a Boltzmann machine?
100,What restriction does an RBM impose on the connections between pieces in a Boltzmann machine?
101,What variables can lead to misleading associations?
101,Which factors must be controlled for in research and statistical analysis?
101,How do confounding variables impact dependent and independent variables?
102,What is the average magnitude of errors in a predictive model?
102,How does MSE penalize larger prediction errors?
102,What is commonly used as a loss function in regression and optimization tasks?
103,What framework in theoretical computer science provides guarantees on machine learning algorithm efficiency?
103,How does PAC learning relate to understanding machine learning algorithms' performance from limited samples?
103,What is the main goal of the Probably Approximately Correct (PAC) learning framework?
104,What is a concise measure of data spread around its mean?
104,How does standard deviation quantify individual data points' distance from the mean?
104,"What is the typical deviation of data values from their mean, as expressed by standard deviation?"
105,What type of neural network architecture is designed to process sequential data?
105,How do recurrent neural networks differ from feedforward neural networks?
105,What are some common tasks that recurrent neural networks are well-suited for?
106,What ensemble learning method uses numerous decision trees to reduce overfitting?
106,How does an ensemble model improve its ability to generalize?
106,What is the primary benefit of using multiple decision trees in a single model?
107,What is the probability of observing results as extreme as those obtained under the null hypothesis?
107,Under what conditions would we expect to observe results as extreme as those obtained in this scenario?
107,"What is the likelihood of obtaining results at least as extreme as those observed, assuming the null hypothesis is true?"
108,What NLP technique involves understanding speaker's goals and context?
108,How does one derive intended meaning from a given text in NLP?
108,"In NLP, what is the process of going beyond literal content to infer meaning?"
109,What distinguishes a regular expression from another pattern matching tool?
109,How does regular grammar differ from string manipulation?
109,What is the primary function of regular expressions in text processing?
110,What are the distinct phases in a machine learning project?
110,How does one ensure high-quality data for modeling purposes?
110,What is the process to refine and deploy an effective model?
111,"What is robotics, in simple terms?"
111,What are the main goals of robotics technology?
111,How does robotics contribute to productivity and safety?
112,What types of biases can occur during sampling?
112,Which biases in sampling methods can lead to incorrect population representation?
112,What are the common pitfalls that can skew results when collecting data?
113,What does the ROC curve measure in binary classification?
113,When is it appropriate to use a ROC curve for model evaluation?
113,What type of outcomes can be predicted using a classifier that utilizes an ROC curve?
114,What are type I and type II errors in statistical hypothesis testing?
114,"When is a correct hypothesis wrongly rejected, and when is an incorrect hypothesis wrongly accepted?"
114,What are the two main kinds of errors that occur during statistical hypothesis testing?
115,What is the core concept behind predictive modeling?
115,How do predictive models utilize historical data to make forecasts?
115,What algorithms are commonly used in training predictive models?
116,What are some essential Python libraries for machine learning tasks?
116,"Which libraries are commonly used in data manipulation, numerical operations, and scientific computing within ML?"
