id,Question,Answer
132,Explain weak AI briefly.,"Weak AI, referred to as Narrow or Applied AI, encompasses AI systems tailored for specific tasks or domains, exhibiting intelligence within limited contexts. Unlike AGI, weak AI lacks human-like cognitive abilities, focusing on solving particular problems efficiently, making it suitable for applications like virtual assistants, recommendation systems, and image recognition."
133,Define TF/IDF vectorization and its role in text processing.,"TF-IDF vectorization converts text into numerical vectors, capturing word importance for analysis, aiding tasks like document clustering or sentiment analysis."
134,Define hyperparameters and their definition.,"Hyperparameters are parameters set before model training, governing network architecture, training process, and optimization strategy, influencing model performance and behavior, and requiring careful selection and tuning to ensure optimal learning and generalization in machine learning tasks."
135,"Differentiate between pass, continue, and break.",Pass is a placeholder; Continue skips iteration; Break exits loop prematurely.
136,Are CNNs resistant to rotations? What happens to the predictions of a CNN if an image is rotated?,"Convolutional Neural Networks (CNNs) inherently lack rotation invariance, meaning a model's predictions can be affected if the input image is rotated unless the dataset has been augmented with rotated examples during training."
137,How can the entropy of the English language be estimated?,"English language entropy estimation utilizes N-grams analysis to evaluate letter probabilistic distributions and sequences, providing insights into linguistic complexity and information content."
138,Explain parsing.,"Parsing is the process by which sentences are broken down and analyzed to understand the grammatical structure and relationship between words, which is crucial for natural language understanding and other NLP tasks."
139,What is econometrics?,"Econometrics uses statistical techniques to analyze economic data, helping to understand economic relationships and predict future trends based on historical data."
140,"Explain the differences between %, /, and // operators in Python.","% calculates the remainder after division, / yields the quotient, and // performs floor division, truncating the quotient to the nearest integer. These operators serve distinct purposes in arithmetic operations, addressing specific requirements like computing remainders or obtaining integer results. Understanding their distinctions enables precise numerical computations across various mathematical contexts."
141,Clarify the concept of Jupyter Notebook.,"Jupyter Notebook is a popular open-source web application utilized for creating and sharing documents that integrate live code, equations, visualizations, and narrative text. It provides an interactive computing environment where users can write and execute code, visualize data, and generate dynamic reports or presentations. Jupyter notebooks support various programming languages, including Python, R, and Julia, making them versatile tools for data analysis, scientific computing, and machine learning experimentation. With features like inline plotting and markdown support, Jupyter notebooks facilitate collaborative research, prototyping, and reproducible workflows in fields like artificial intelligence, data science, and academic research. Their flexibility and interactivity make them invaluable tools for exploring, documenting, and sharing computational workflows and findings."
142,Describe the bag of words model and its application in text classification.,"The Bag of Words model simplifies text by treating it as a collection of independent items, allowing for straightforward but effective text categorization and information retrieval based on word frequencies."
143,Can you describe the concept of transfer learning in computer vision?,"Transfer learning in computer vision is a technique where a model developed for a specific task is repurposed on a second related task, utilizing the knowledge gained during training on the first task to improve learning on the second."
144,Give a brief explanation of principal component analysis.,"Principal Component Analysis (PCA) is a dimensionality reduction technique used to identify patterns and relationships in high-dimensional data. It analyzes the variance in the data and identifies the principal components, which are linear combinations of the original variables that explain the maximum variance. By retaining the most important features while reducing dimensionality, PCA simplifies complex datasets, facilitates visualization, and enables efficient data analysis and interpretation. PCA is widely used in various fields, including finance, image processing, and genetics."
145,"Which algorithm does Facebook use for face verification, and how does it work?","Facebook utilizes DeepFace for face verification, employing neural networks to detect, align, extract patterns, and classify faces accurately, leveraging large training datasets for robust performance."
146,What are some key differences between OLAP and OLTP?,"OLAP and OLTP serve distinct purposes in data management and analysis. OLTP, or Online Transaction Processing, handles operational data and transactions, supporting quick access to essential business information through simple queries and normalized database structures. In contrast, OLAP, or Online Analytical Processing, integrates data from diverse sources to provide multidimensional insights for decision-making, utilizing denormalized databases and specialized querying techniques to analyze complex business events and trends."
147,Can you clarify the concept of generalized linear model?,"Generalized linear models (GLMs) extend traditional linear regression to allow for response variables that have error distribution models other than a normal distribution, accommodating binary, count, and other data types."
148,Explain the difference between data profiling and data mining.,"Data profiling examines individual data attributes, providing insights into data characteristics, while data mining uncovers patterns and relations in data, enabling predictive modeling and decision-making. While data profiling offers a descriptive summary of data attributes, data mining performs exploratory analysis to extract actionable insights and discover hidden relationships, enhancing understanding and utilization of data in various domains and applications."
149,What is openNLP?,"Apache OpenNLP is a machine learning-based toolkit for processing natural language text. It supports common NLP tasks such as tokenization, parsing, named entity recognition, and more."
150,What is a detectable difference?,"Detectable difference refers to the smallest effect size that can be reliably identified by a statistical test, given its power to discern true effects from random variation in the data."
151,How can you combat overfitting and underfitting?,"To combat overfitting and underfitting, one can utilize various methods. Resampling the data and estimating model accuracy, using a validation set to evaluate the model's performance, and applying regularization techniques are common approaches. Regularization adds a penalty term to the model's loss function to prevent it from becoming overly complex, thus reducing overfitting."
152,What does an S curve entail?,"The S-curve is a graphical depiction of variable changes over time, characterized by an initial slow growth phase, followed by rapid acceleration, and eventual saturation or stabilization. It is often observed in phenomena such as technological adoption, population growth, or product lifecycle, reflecting the dynamics of exponential growth and market saturation. The S-curve serves as a visual tool for analyzing and forecasting trends, guiding strategic decision-making and resource allocation."
153,What are the tools of AI?,"AI tools range from libraries like Scikit Learn for machine learning to TensorFlow and Keras for deep learning, providing environments for developing AI models."
154,What does computer-aided diagnosis (CADx) involve?,"Computer-aided diagnosis (CADx) systems support the interpretation of medical images, providing assistance to radiologists in differentiating between benign and malignant findings."
155,What is TensorFlow?,"TensorFlow is a versatile and scalable machine learning framework designed for building and deploying AI models across various domains. Developed by Google Brain, TensorFlow offers comprehensive support for deep learning, reinforcement learning, and distributed computing, empowering developers and researchers to create advanced AI solutions, from simple neural networks to complex deep learning architectures."
156,Explain the survival function.,"The survival function, also known as the survival curve, represents the probability that a subject will survive beyond a given time point. It estimates the proportion of individuals free from an event of interest, such as death or failure, at each time point, providing valuable insights into the time course of events in survival analysis."
157,"What is the ""kernel trick,"" and how is it useful?","The kernel trick computes inner products between data pairs in a higher-dimensional space efficiently, enabling algorithms to operate effectively with lower-dimensional data. It enhances computational efficiency and performance, making high-dimensional calculations feasible with lower-dimensional data."
158,"Define ETL (Extract, Transform, Load) and its role in data integration.","ETL stands for Extract, Transform, Load, and it describes the process of taking data from one or more sources, converting it into a format that can be analyzed, and loading it into a data warehouse or system for use in reporting and analytics."
159,Explain the concept and significance of cross-validation in model evaluation.,Cross-validation is a statistical technique for evaluating how well a model will generalize to an independent dataset by partitioning the original data into a training set to train the model and a test set to evaluate it.
160,Can you summarize the significance of classification threshold?,The classification threshold is a cutoff point used in logistic regression and other probabilistic classifiers to distinguish between different class labels based on predicted probabilities.
161,Can you summarize the purpose of cross-validation in machine learning?,"Cross-validation is a technique used to evaluate the generalizability of a statistical model, by partitioning the data into subsets and testing the models ability to predict new data not used during training."
162,"What are three types of statistical biases, and can you explain each with an example?","Sampling bias occurs when a sample is biased due to non-random selection. For instance, if out of 10 people in a room, only three females are surveyed about their preference between grapes and bananas, and the conclusion is drawn that most people prefer grapes, it demonstrates sampling bias. Confirmation bias refers to the inclination to favor information that aligns with one's beliefs. Survivorship bias is observed when only individuals who have ""survived"" a lengthy process are included or excluded in an analysis, leading to a skewed sample."
163,What is COSHH (Control of Substances Hazardous to Health)?,COSHH is an approach to scheduling tasks in a Hadoop environment that takes into account the classification and optimization of jobs based on various resource characteristics and demands.
164,Clarify the concept of an outlier.,"Outliers are data points that deviate significantly from the general trend or distribution of the dataset. They may indicate measurement errors, rare events, or genuine anomalies in the data. Identifying and handling outliers is essential in data analysis to prevent skewed results and ensure accurate modeling and inference. Outliers can be detected using statistical methods or visual inspection and should be carefully examined to determine their impact on analysis outcomes and whether they warrant further investigation or data treatment."
165,Outline the process of data validation.,"Data validation involves multiple checks such as verifying data types, detecting outliers and data range, ensuring data formats (especially for dates), and assessing data consistency and uniqueness. These validation steps help identify data quality issues, including inconsistencies, inaccuracies, or missing values, ensuring that data meets predefined quality standards. By validating data integrity and completeness, practitioners can enhance the reliability and usability of datasets for analysis, modeling, and decision-making, minimizing the risk of errors and biases in downstream tasks such as machine learning and business intelligence."
166,Can you clarify the concept of Adagrad?,"AdaGrad, short for Adaptive Gradient Algorithm, adjusts the learning rates for each parameter individually by scaling them according to the accumulation of past gradients, enabling different learning rates for each parameter."
167,What type of algorithm is behind the Customers who purchased this item also bought suggestions on Amazon?,"The recommendations on Amazon are generated through a collaborative filtering algorithm, which relies on user behavior such as transaction history and ratings to suggest items to new users without needing to know the features of the items themselves."
168,Explain how to determine the appropriate number of trees in a random forest.,"The number of trees in a random forest is determined using the n_estimators parameter. Initially, start with a reasonable number of trees and monitor the model's performance as the number of trees increases. Continue adding trees until the performance stabilizes, indicating diminishing returns in predictive accuracy. Finding the optimal number of trees involves a trade-off between model complexity and computational resources."
169,What does the term Q-Learning refer to in reinforcement learning?,Q-Learning teaches an agent to find the best actions to take by trying them out and learning from the rewards or penalties.
170,Differentiate between supervised and unsupervised learning in data science.,"Data science uses scientific methods and algorithms to extract insights from data. Supervised learning uses labeled data for prediction and classification, while unsupervised learning finds patterns and relationships in unlabeled data."
171,Outline the basic concept of recommendation algorithms.,"Recommendation algorithms analyze past user preferences and interactions to generate personalized suggestions or recommendations for items or content. By identifying patterns and similarities in historical data, these algorithms predict user preferences and offer relevant recommendations, thereby enhancing user experience and engagement. Recommendation algorithms are widely used in e-commerce platforms, content streaming services, social media, and online advertising to personalize content delivery and improve user satisfaction and retention."
172,Describe the process and advantages of business process modeling.,"Business process modeling involves creating detailed flowcharts or diagrams that map out the steps of a business process, offering clarity, improving efficiency, identifying bottlenecks, and streamlining workflow."
173,Clarify the concept of one-hot encoding.,"One hot encoding transforms categorical variables into a binary format, where each category is represented by a binary vector. In this encoding, only one bit is ""hot"" (set to 1) for each category, indicating its presence. This method ensures interpretability for machine learning models, allowing them to understand and process categorical data effectively by representing each category as a separate feature."
174,What is goodness of fit?,"Goodness of fit evaluates how well the observed data aligns with expected patterns or distributions, crucial for validating statistical models."
175,What is the basic concept of an estimator?,"An estimator is a mathematical formula or algorithm that processes sample data to produce a value, which serves as an estimate of an unknown parameter such as a population mean or proportion."
176,Outline the basic concept of relative risk or risk ratio.,"The relative risk or risk ratio compares the probability of an event occurring in one group to the probability of the same event occurring in another group. It measures the strength of association between exposure to a risk factor and the likelihood of experiencing an outcome. Unlike odds ratios and hazard ratios, which can be constant across different populations, risk ratios depend on the baseline risk level and the definition of the event being studied. Understanding relative risk is crucial in epidemiology and clinical research for assessing the impact of interventions or exposures on health outcomes."
177,What is a perceptron?,"The perceptron is a fundamental unit of a neural network, often used in binary classification tasks. It is an algorithm that makes predictions based on a linear predictor function by weighing inputs with weights and biases."
178,What is the difference between information extraction and information retrieval?,"Information Extraction (IE) derives semantic info like named entity recognition. Information Retrieval (IR) stores and retrieves data, akin to database searches. IE deals with text analysis, while IR focuses on data storage and retrieval, both crucial for information management systems."
179,Can you explain the gate or general architecture for text engineering?,"GATE (General Architecture for Text Engineering) is a comprehensive framework that provides tools for various NLP tasks, and its modular design allows for the incorporation and integration of additional processing resources."
180,List some real-world applications of natural language processing (NLP).,"NLP finds application in speech recognition, powering virtual assistants to understand and respond to spoken commands, enhancing user experience."
181,What are the three types of slowly changing dimensions?,"Slowly Changing Dimensions (SCD) manage changes over time in a data warehouse. Type 1 overwrites data, Type 2 preserves historical data, and Type 3 tracks changes using additional columns."
182,"What is rack awareness, and how does it apply to distributed systems?",Rack awareness is a strategy in distributed systems like Hadoop that optimizes network traffic and data reliability by organizing data storage across multiple racks efficiently.
183,What tools are used for training NLP models?,"Tools for training NLP models include NLTK for language processing tasks, spaCy for advanced NLP, and PyTorch-NLP for deep learning in NLP."
184,Explain how to set the learning rate in machine learning algorithms.,"Setting the learning rate in machine learning involves starting with a small value (e.g., 0.01) and adjusting based on model performance. The learning rate controls the size of parameter updates during training and affects convergence speed and model stability. Experimentation and evaluation help identify an optimal learning rate that balances convergence speed without overshooting or converging too slowly. By iteratively adjusting the learning rate and monitoring model performance, practitioners can optimize training dynamics and achieve faster convergence and better generalization in machine learning models."
185,Define and describe the concept of knowledge engineering.,"Knowledge engineering is a discipline within artificial intelligence (AI) concerned with designing, building, and maintaining knowledge-based systems that mimic human expertise in specific domains. It involves eliciting, representing, and formalizing knowledge from human experts into a computable form that machines can utilize for problem-solving, decision-making, and reasoning tasks. Knowledge engineers leverage various techniques, including rule-based systems, ontologies, and knowledge graphs, to capture and encode domain-specific knowledge effectively. By bridging the gap between human expertise and machine intelligence, knowledge engineering facilitates the development of expert systems, diagnostic tools, and decision support systems across diverse fields such as medicine, finance, and engineering."
186,Explain how XGBoost manages the bias-variance tradeoff.,"XGBoost mitigates bias and variance by employing boosting and ensemble techniques. Boosting iteratively combines weak models to produce a strong learner, focusing on minimizing errors and improving predictions. By taking a weighted average of multiple weak models, XGBoost reduces both bias and variance, resulting in a robust and accurate final model. Additionally, ensemble techniques, such as bagging and feature subsampling, further enhance model generalization by reducing overfitting and increasing diversity among base learners. This comprehensive approach effectively balances bias and variance, yielding high-performance models across various machine learning tasks."
187,What assumptions underlie linear regression?,"Linear regression assumes that variables have linear relationships, errors exhibit constant variance (homoscedasticity), predictors are not highly correlated (no multicollinearity), and errors follow a normal distribution."
188,What are some ways to reshape a pandas DataFrame?,"In pandas, reshaping dataframes can be done by stacking or unstacking levels, or melting, which changes the shape by pivoting on identifiers and making data more tidy for analysis."
189,Are there regularizers for neural networks?,"Neural networks use regularizers like dropout to prevent overfitting, which involves randomly disabling neurons during training to encourage model simplicity."
190,Explain capturing correlation between continuous and categorical variables.,"ANCOVA (Analysis of Covariance) is a statistical technique used to analyze the relationship between a continuous dependent variable and a categorical independent variable, while controlling for one or more continuous covariates. It extends the traditional ANOVA method by incorporating covariates into the analysis, enabling the assessment of the relationship between the main effects and the covariates. ANCOVA allows researchers to investigate how categorical variables impact continuous outcomes while accounting for the influence of covariates, providing a comprehensive understanding of the relationship between variables in statistical analysis."
191,How would you briefly summarize the key idea of true positive?,"True positives signify instances where a diagnostic test correctly identifies individuals as having a particular condition when they truly possess it. They are fundamental for evaluating a test's sensitivity, reflecting its ability to accurately detect the presence of a condition, thereby aiding in early diagnosis and intervention."
192,Explain the bias-variance tradeoff in machine learning.,"The bias-variance tradeoff manages model complexity, preventing underfitting or overfitting. A balanced model captures underlying patterns without memorizing noise. High bias models simplify relationships, risking underfitting, while high variance models capture noise, risking overfitting. Achieving an optimal balance enhances predictive performance."
193,Clarify the concept of marginal and marginalization.,"Marginal quantities or estimates represent averages over specific units or characteristics, often obtained by summing or averaging conditional quantities. Marginalization refers to removing conditioning on a factor, allowing for analysis across broader contexts or aggregating information. For example, in a 2x2 frequency table, marginal estimates sum columns across rows to obtain overall probabilities, enabling broader insights into the relationship between variables. Marginalization facilitates understanding patterns and relationships by considering overall trends rather than specific conditions."
194,What is the purpose of a namenode in HDFS?,The NameNode in HDFS is like a library's index; it keeps track of where all the files are stored in the system.
195,What is a brief description of a baseline?,"A baseline in machine learning establishes a reference point against which the performance of more complex models can be compared, often serving as a simple starting model."
196,Why are activation functions required in neural networks?,"Activation functions introduce nonlinearity, enabling neural networks to learn complex relationships between inputs and outputs, enhancing model capacity and expressiveness."
197,Can you explain a bidirectional search algorithm?,"A bidirectional search algorithm runs two simultaneous searches: one forward from the starting point and one backward from the goal. The aim is to meet in the middle, thus potentially finding a solution faster than a unidirectional search."
198,Do gradient descent methods always converge to similar points?,"Gradient descent methods may converge to different local optima, which depend on the starting conditions and the nature of the cost function."
199,Describe word2vec.,"Word2vec is a suite of models used to produce word embeddings, trained to predict surrounding words in a linguistic context."
200,What is the difference between a generative and discriminative model?,"Generative models learn data categories, while discriminative models learn category distinctions. Discriminative models generally outperform generative models in classification tasks."
