id,Question,Answer
70,Elaborate on Python's role in enabling data engineers.,"Python empowers data engineers by providing robust libraries such as NumPy, pandas, and scipy, which offer efficient tools for data processing, statistical analysis, and data preparation tasks. NumPy enables numerical computations and array operations, pandas facilitates data manipulation and analysis through DataFrame objects, while scipy offers scientific computing functionalities. Leveraging these libraries, data engineers can streamline data workflows, extract meaningful insights, and prepare data for downstream tasks such as machine learning and analytics, enhancing productivity and efficiency in data-driven projects."
71,Describe the purpose and functioning of ensemble methods in machine learning.,Ensemble methods combine predictions from multiple machine learning models to improve accuracy and robustness over single model predictions.
72,Summarize the key idea of a perceptron briefly.,"The perceptron is a basic neural network architecture consisting of a single neuron designed to approximate binary inputs. It receives input signals, applies weights to them, and produces an output based on a threshold function. While limited to linearly separable problems, perceptrons form the building blocks of more complex neural networks and paved the way for modern deep learning architectures. Despite its simplicity, the perceptron laid the foundation for neural network research and contributed to the development of advanced machine learning techniques."
73,"Can you give a brief explanation of augmented intelligence, also known as intelligence augmentation (IA)?","Augmented Intelligence, or Intelligence Augmentation (IA), refers to technology designed to enhance human intelligence rather than operate independently, assisting humans in making decisions and completing tasks."
74,What are generative adversarial networks (GAN)?,"Generative Adversarial Networks are a class of artificial intelligence models composed of two networks, the generative and the discriminative, which are trained simultaneously to generate new, synthetic instances of data that are indistinguishable from real data."
75,What is the difference between NLTK and openNLP?,"NLTK is Python-based, while OpenNLP is Java-based."
76,"What is a minimax algorithm, and explain its terminologies?","The minimax algorithm optimizes decision-making for game players by simulating moves and countermoves, ensuring an optimal strategy against an opponent assuming optimal play."
77,What is a retrospective study?,"Retrospective studies analyze historical data or events to investigate relationships, associations, or outcomes retrospectively. Researchers collect data from past records, documents, or databases to examine the occurrence of outcomes and potential risk factors or exposures. Retrospective studies are commonly used in epidemiology, clinical research, and social sciences to explore hypotheses, identify trends, or assess the impact of interventions retrospectively. However, retrospective studies may be subject to biases and limitations due to reliance on existing data and potential confounding variables."
78,Differentiate between data mining and data warehousing.,"Data mining uncovers patterns and relationships in data, whereas data warehousing integrates and stores data for analysis purposes. While data mining extracts actionable insights from large datasets, data warehousing facilitates data storage, retrieval, and analysis by consolidating data from multiple sources. Both play complementary roles in extracting value from data, enabling informed decision-making and strategic planning in organizations."
79,Explain the difference between online and batch learning.,"Online learning processes one observation at a time, while batch learning uses the entire dataset at once."
80,Which Python libraries are you familiar with?,"Python libraries like NumPy, Pandas, and Scikit-Learn are widely used for data manipulation and machine learning tasks, while Keras and TensorFlow are popular for deep learning applications."
81,Outline the basic concept of residual.,"Residuals represent the discrepancy between observed and predicted values in a statistical model, reflecting the unexplained variability that remains after accounting for the effects of predictor variables. In regression analysis, residuals quantify the degree to which the model fits the observed data. Ideally, residuals should be randomly distributed around zero, indicating that the model adequately captures the underlying relationships between variables. Residual analysis is essential for assessing the goodness-of-fit and assumptions of regression models, guiding model refinement and interpretation."
82,Outline the concept of inter-rater agreement.,"Inter-rater agreement assesses the consistency or reliability of human raters when performing a task, such as coding, scoring, or classifying observations. It quantifies the level of agreement or consensus between raters, often using statistical metrics like Cohen's kappa or Fleiss' kappa. Higher agreement indicates greater reliability in human judgments, while discrepancies suggest areas for improvement in task instructions or rater training to enhance consistency and accuracy in assessments."
83,Summarize the purpose of the input layer in neural networks.,"The input layer of a neural network is where the raw input data is received and processed. It consists of nodes corresponding to input features, with each node representing a feature value. The input layer serves as the entry point for data into the neural network, transmitting input signals to subsequent layers for further processing and analysis. Its primary function is to transform raw data into a format suitable for propagation through the network, initiating the process of information flow and computation in the neural architecture."
84,Describe strata and stratified sampling shortly.,"Stratified sampling involves partitioning the population into distinct and homogeneous subgroups (strata) based on specific characteristics. By drawing random samples from each stratum, this technique ensures proportional representation of various subgroups, enabling more accurate and precise estimates of population parameters while minimizing sampling bias and enhancing the reliability of study results."
85,Discuss the relationship between data imputation and mean imputation.,"Mean imputation of missing data is often discouraged due to several limitations and drawbacks. Firstly, mean imputation ignores the potential relationship between features, leading to biased estimates and inaccurate representations of the data. For instance, if missing values are imputed with the mean of the entire dataset, it may artificially inflate or deflate feature values, distorting the underlying patterns or distributions. Additionally, mean imputation reduces the variability of the data, increasing bias and underestimating uncertainty in the model. This narrower confidence interval limits the model's robustness and generalization performance, compromising the reliability of predictions or inferences. Consequently, alternative imputation methods that preserve data structure and account for feature dependencies, such as multiple imputation or predictive modeling, are preferred in practice for handling missing data effectively."
86,Explain how time series forecasting is performed in machine learning.,"Time series forecasting involves employing a range of techniques tailored to the data characteristics. Autoregressive models capture dependencies between lagged observations, while moving average models focus on smoothing fluctuations. Advanced methods like Prophet or LSTM networks excel at capturing complex patterns and long-term dependencies in sequential data. Choosing the appropriate technique depends on the data properties and forecasting requirements to ensure accurate predictions."
87,Can you outline the basic concept of root mean squared error or RMSE?,"Root Mean Squared Error (RMSE) quantifies the average deviation between observed and predicted values in a regression analysis. It measures the dispersion or variability of data points around the regression line, providing a comprehensive assessment of model accuracy. By taking the square root of the mean squared error, RMSE represents the typical magnitude of prediction errors, facilitating the comparison of model performance and guiding model selection or refinement processes."
88,What does OLAP signify in data warehousing?,"OLAP systems facilitate complex analytical queries and multi-dimensional analysis, which is essential for decision support and business intelligence applications."
89,Summarize how to prevent overfitting in a model.,"Preventing overfitting involves techniques like cross-validation, regularization, and model complexity control. Cross-validation methods such as K-fold validation help assess model performance on unseen data, reducing the risk of overfitting to training data. Regularization techniques penalize overly complex models to prioritize simpler, more generalizable solutions. Controlling model complexity through feature selection or dimensionality reduction also mitigates overfitting by focusing on essential information. By applying these strategies, practitioners can build robust models that generalize well to new data and avoid overfitting pitfalls in machine learning applications."
90,Differentiate between supervised and unsupervised learning.,"Supervised learning utilizes labeled data for training, whereas unsupervised learning extracts patterns from unlabeled data, useful for tasks like clustering or dimensionality reduction."
91,Differentiate between indexing and slicing.,Indexing retrieves individual elements; slicing fetches sequences of elements.
92,Define machine learning and its types.,"Machine learning involves training models to perform tasks by learning from data, rather than through explicit programming. It encompasses a variety of techniques and algorithms used for pattern recognition, prediction, and data-driven decision-making."
93,What is the basic concept of gradient?,"The gradient indicates the direction of maximum increase of a function, essential for optimization algorithms like gradient descent."
94,Clarify the concept of limited memory.,"Limited memory systems can retain information within a defined timeframe, essential for tasks requiring temporal context or real-time processing."
95,What is superintelligence?,"Superintelligence refers to hypothetical artificial or human-created intelligence that significantly exceeds the cognitive abilities of humans across multiple domains. Speculation about the implications of such intelligence often revolves around its potential to solve complex problems, accelerate scientific discovery, and fundamentally alter societal structures, posing both opportunities and risks for humanity."
96,What are project deliverables?,Project deliverables are the tangible or intangible outcomes of a project that fulfill the project's objectives and are handed over to the client or stakeholder upon completion.
97,What is flexible string matching?,"Flexible string matching, or fuzzy string matching, allows for the identification of strings that are similar but not identical to a given pattern, useful in search functions and data cleaning."
98,Can you provide a brief explanation of gradient descent?,"Gradient descent updates model parameters iteratively, moving towards the minimum loss point by adjusting weights and biases based on the computed gradients."
99,How do you clarify the concept of type I error?,"Type I error occurs when a statistical test incorrectly concludes that there is a significant effect or difference when, in reality, no such effect exists. It represents the probability of erroneously rejecting the null hypothesis, potentially leading to erroneous conclusions and misguided decisions based on statistical analyses."
100,Can you explain the Boltzmann machine and what is a restricted Boltzmann machine?,"A Boltzmann machine is a network that makes decisions by considering how changing one piece can affect the whole, and an RBM simplifies this by restricting connections."
101,What are confounding variables?,"Confounding variables affect both dependent and independent variables, leading to misleading associations and potentially erroneous conclusions, highlighting the importance of controlling for confounding factors in research and statistical analysis to ensure accurate and valid results."
102,What is the mean squared error (MSE)?,"Mean Squared Error (MSE) calculates the average of the squared differences between predicted and observed values in a dataset. It provides a measure of the average magnitude of errors in a predictive model, emphasizing larger errors due to the squaring operation. MSE is commonly used as a loss function in regression and optimization tasks, guiding the training process to minimize prediction errors. While sensitive to outliers, MSE penalizes larger errors more heavily than smaller ones, offering a comprehensive assessment of prediction accuracy. Its widespread adoption in machine learning and statistical modeling underscores its utility in evaluating model performance and guiding model improvement efforts."
103,Define PAC learning.,Probably Approximately Correct (PAC) learning is a framework in theoretical computer science that seeks to understand the efficiency of machine learning algorithms in terms of their ability to provide guarantees on the performance of learned functions from limited samples.
104,Explain standard deviation briefly.,"Standard deviation measures the spread or variability of data points around the mean of a distribution. It quantifies the average distance of individual data points from the mean, providing insights into the dispersion of data. By taking the square root of the variance, standard deviation expresses the typical deviation of data values from the mean, offering a concise summary of data variability and aiding in statistical analysis and decision-making processes."
105,Give a brief explanation of recurrent neural network (RNN).,"Recurrent neural networks (RNNs) are neural network architectures designed to process sequential data by maintaining an internal state or memory. Unlike feedforward neural networks, RNNs establish connections between nodes in a directed graph along a temporal sequence, enabling them to capture temporal dependencies and exhibit dynamic behavior over time. RNNs are well-suited for tasks involving sequential data, such as time series forecasting, natural language processing, speech recognition, and handwriting recognition, due to their ability to model temporal relationships and context."
106,Can you explain the concept of random forests?,Random forests are an ensemble learning method that builds numerous decision trees during training and makes predictions by averaging the results. This process helps in reducing overfitting and improving the model's ability to generalize.
107,Define the p-value.,The p-value is the probability of observing results as extreme as the ones obtained under the null hypothesis.
108,Explain pragmatic analysis in NLP.,"Pragmatic analysis in NLP involves deriving the intended meaning or action from a given text by considering context, goals of the speaker, and inferred knowledge, beyond just the literal content."
109,What distinguishes a regular expression from regular grammar?,"Regular expressions are pattern matching tools for character sequences, enabling string manipulation and matching, whereas regular grammars generate regular languages, describing formal language structures. While regular expressions facilitate text processing and pattern matching tasks, regular grammars provide formal rules for generating and recognizing regular languages, offering essential tools for linguistic analysis and formal language description in various computational contexts."
110,Name the life stages of model development in a machine learning project.,"Model development progresses through various stages, starting with defining the business problem and understanding data requirements. Exploratory analysis and data preparation ensure data quality and understanding. Feature engineering optimizes input variables for modeling. Data split separates training and testing datasets. Model building, testing, and implementation iteratively refine and deploy the model. Performance tracking monitors model effectiveness over time, ensuring continuous improvement and alignment with evolving business needs."
111,What is the key idea behind robotics summarized briefly?,"Robotics encompasses the interdisciplinary field of technology involving the design, development, operation, and application of robots. These machines are designed to perform tasks autonomously or semi-autonomously, ranging from industrial automation to healthcare assistance and exploration. Robotics aims to enhance productivity, improve safety, and expand the capabilities of humans by automating repetitive, hazardous, or physically demanding tasks across various industries and domains."
112,What types of biases can occur during sampling?,"Sampling biases include selection bias, undercoverage bias, and survivorship bias, all of which can skew results and misrepresent populations."
113,Explain the ROC curve and when to use it.,The ROC curve evaluates binary classifiers' performance and is used when predicting probabilities of binary outcomes.
114,What are type I and type II errors?,"A type I error occurs when a correct hypothesis is wrongly rejected, while a type II error occurs when an incorrect hypothesis is wrongly accepted, reflecting the two main kinds of errors in statistical hypothesis testing."
115,Summarize the key idea of predictive modeling briefly.,"Predictive modeling involves building mathematical models based on historical data to forecast future outcomes. By identifying patterns and relationships in past data, predictive models can make accurate predictions about future events or behaviors, enabling businesses to make informed decisions and optimize strategies. These models are trained using algorithms such as regression, decision trees, or neural networks to learn from data and generalize patterns, allowing for reliable predictions in real-world scenarios."
116,Which Python libraries are frequently used in machine learning?,"Common ML libraries include Pandas for data manipulation, NumPy for numerical operations, SciPy for scientific computing, Sklearn for ML algorithms, and TensorFlow for deep learning."
117,Provide a short description of a model.,"A model in statistical analysis specifies the probabilistic relationship between variables, enabling predictions. It's constructed using algorithms and trained on data to learn patterns and make forecasts. Models play a crucial role in various domains, facilitating decision-making and understanding complex systems by quantifying relationships and predicting outcomes based on input variables."
118,Describe K-fold cross-validation.,"K-fold cross-validation involves dividing the dataset into k consecutive folds and then systematically using one fold as the validation set and the others as the training set. This method ensures that each data point is used for both training and validation, which helps in assessing the model's generalization performance."
119,What are the possible approaches to solving the cold start problem?,"Content-based filtering and demographic filtering are common strategies to address the cold start problem in recommendation systems. Content-based filtering recommends items based on their attributes and similarities to items a user has interacted with, bypassing the need for historical user ratings. Demographic filtering leverages user profiles or demographic information to recommend items tailored to user preferences, mitigating the cold start problem for new users by identifying similarities with existing user segments. These approaches enable recommendation systems to provide personalized recommendations even for new users or items with sparse data, enhancing user satisfaction and engagement."
120,What does classification entail in machine learning?,"Classification in machine learning is the process of predicting the category to which a new observation belongs, based on a training dataset of pre-categorized instances."
121,Outline strategies for dealing with unbalanced binary classification.,"Addressing unbalanced binary classification involves several strategies: reconsidering evaluation metrics, increasing the penalty for misclassifying the minority class, and balancing class distribution through oversampling or undersampling techniques. By adopting appropriate metrics such as precision and recall, adjusting misclassification penalties, or rebalancing class distribution, classifiers can effectively handle imbalanced datasets and improve performance in identifying minority classes, ensuring reliable predictions in real-world scenarios."
122,Can you summarize the key concept of a chatbot?,"A chatbot is an AI application that simulates a conversation with human users by interpreting and responding to their messages, often providing customer service or information access."
123,"Outline the basic concept of predictor, explanatory variable, risk factor, covariate, covariable, independent variable.","In statistical analysis, various terms are used interchangeably to refer to variables that influence outcomes. Predictors, explanatory variables, risk factors, covariates, covariables, and independent variables are all terms used to describe factors that may affect the outcome of interest. These variables can be measured at baseline or updated over time and are essential for understanding relationships and making predictions in research or modeling. Differentiating between these terms helps clarify their roles in statistical analysis and experimental design."
124,What is partial order planning?,"Partial order planning is used in artificial intelligence to build plans that are flexible regarding the order of operations. It allows for more complex planning where the exact sequence of actions is not predetermined, allowing for more adaptable solutions."
125,Discuss different algorithms for hyperparameter optimization.,"Hyperparameter optimization employs various algorithms like Grid Search, Random Search, and Bayesian Optimization. Grid Search exhaustively explores parameter combinations, Random Search randomly samples from a predefined space, and Bayesian Optimization uses Bayesian inference to direct the search efficiently, each offering distinct advantages in finding optimal hyperparameters for machine learning models."
126,What are the common ETL tools used during data warehousing activities?,"In data warehousing, popular ETL (Extract, Transform, Load) tools include Informatica for enterprise data integration, Talend for data management and integration, Ab Initio for handling large data volumes, Oracle Data Integrator for combining with Oracle databases, Skyvia for cloud data integration, SSIS for SQL Server integration, Pentaho for business analytics, and Xplenty for ETL processes in the cloud."
127,What are the two paradigms of ensemble methods?,"Ensemble methods improve predictions by combining models. Parallel methods like Bagging build models independently, while sequential methods like Boosting focus on correcting predecessor errors."
128,Provide a brief explanation of k-nearest neighbors (KNN).,"K-nearest neighbors (KNN) is a simple and intuitive machine learning algorithm used for classification and regression tasks. It operates by identifying the 'k' nearest data points (neighbors) to a query point in the feature space and classifying the query point based on the majority class (for classification) or averaging the target values (for regression) of its neighbors. KNN relies on the assumption that similar data points tend to belong to the same class or have similar target values, making it effective for tasks involving local patterns or neighborhoods in the data."
129,Define and illustrate the concept of convex hull in geometry.,"In support vector machines (SVM), the convex hull concept relates to finding the hyperplane that best divides data into classes with the maximum margin, ensuring optimal separation."
130,Clarify whether logistic regression is considered a linear model and explain why.,"Logistic Regression is indeed a linear model because it models the relationship between the independent variables and the logarithm of the odds of the dependent variable. Despite the name ""regression,"" logistic regression is used for classification tasks, where it predicts the probability of an observation belonging to a particular class. The model's decision boundary is linear in the feature space, making logistic regression a linear classifier suitable for binary and multiclass classification problems."
131,List variants of recurrent neural networks (RNN).,"Variants of Recurrent Neural Networks (RNNs) include Long Short-term Memory (LSTM) and Gated Recurrent Unit (GRU), designed to address the vanishing gradient problem. Additionally, architectures like end-to-end networks and memory networks enhance RNN capabilities for tasks involving sequential data processing, offering improved memory and learning capacity. These variants cater to different requirements in NLP and sequential modeling, providing flexibility and efficiency in capturing long-range dependencies and context in data."
